,Sentiment,Sent_Scale,Text,Topic Key,Country,Type of Resources
730,Very Positive,4.8306,"I like to consider myself an ""otherwise-smart"" person (engineer in the renewable industry) and hydrogen is absolutely important for a decarbonized future. I'm surprised your comment got so many upvotes in an energy sub tbh. It's not just an electricity alternative. The Haber-Bosch process is arguably the most important industrial process ever developed (used primarily for the production of fertilizer) and it relies on hydrogen that currently comes from natural gas at a huge carbon cost. And even when it is an electricity alternative, it has an energy density 175x that of li-ion cells. Yes, batteries won the 'format war' for cars, but ships? airplanes? Hydrogen will be important there because of that energy density unless there's some miracle battery breakthrough which seems unlikely. As for cost, green hydrogen is expensive now... but that's largely because it's not produced at scale because there's no demand yet. It also looks like hydrogen is poised to be the dominant 'power-to-X' commodity. In a fully renewable world, there will be lots of curtailment. If electric demand is low, and the wind is blowing, you can either shut your wind turbine off, or use the excess power to make 'free' hydrogen. The latter makes sense and will drive costs down.",Infrastructure,Australia,Hydro Power
731,Neutral,3.0,"I'm a H2 skeptic but Australia ( and maybe North Africa?) might make sense. In Australia you have millions of acres of land that are from marginal through to desert, with sun 360 days a year and very negligible population density. Water is scarce but assuming they're situating plants near the coast then electrolysing water into hydrogen is about as cheap as it gets. The bit I can't work out is how it is viable after shipping costs.",Infrastructure,Australia,Hydro Power
732,Very Positive,4.7038,"People and governments are pouring tens of billions into hydrogen. Whether or not you buy the hype, it is a great field for a huckster to make pious statements about saving the world while fleecing everyone involved.",Tax,Australia,Hydro Power
733,Very Negative,1.9154,"I understand the snarky comments here, but seriously, would you guys prefer him to be a climate change denier? Even if what he's saying is just rhetoric and he ends up not doing anything, him saying it still helps sway large amounts of people who dismiss climate change unless they hear from literal billionaires. If the only people fighting climate change are leftist activists then we are skrewed.",Tax,Australia,Hydro Power
734,Neutral,3.0,I upvoted you because reality dictates that fully decarbonizing industry will require massive investments from everyone.,Technology,Australia,Hydro Power
735,Positive,4.0846,Fuck Andrew Forrest. Energy belongs to the people. Its not a investment opportunity for a multibillionaire. The last era was marked by wealthy sociopaths holding societies hostage.,Cost,Australia,Hydro Power
736,Neutral,3.7224,this seems more like an advertisement than a story,Cost,Australia,Hydro Power
737,Positive,4.0534,"He doesnt want to save the world, he wants to make money pretending to do so.",Cost,Australia,Hydro Power
738,Very Positive,4.6884,If his billions of dollars actually go to green projects that help save the world then I couldnt care less what his intentions are.,Tax,Australia,Hydro Power
739,Very Positive,4.772,I am thinking the same but i don't think it has to be a problem. What we need to do is to create a regulatory environment where people like him automatically choose 'green(er)' projects instead of toxic projects because they can make more money that way. Changing the rules of the game will hurt some businesses of currently successful entrepreneurs but it will create new opportunities for the same people and opportunities for new entrepreneurs. For workers change doesn't have to hurt. Long term it doesn't matter if you work on a green hydrogen installation or a oil refinery.,Infrastructure,Australia,Hydro Power
740,Neutral,3.5,Look I don't care what his reasons are of he takes billions and puts it to fixing the mess in not going to stop it in fact I'll take some if his money to invest in my own eco projects Like you should do,Tax,Australia,Hydro Power
741,Positive,4.2972,"selfless billionaires are going to save us, great news!",Policy,Australia,Hydro Power
742,Very Positive,4.725,They dont care about saving the planet they see that this is the future way to more wealth,Investment,Australia,Hydro Power
743,Negative,2.6442,"I mean, I am not upset and wouldnt blame the guy if he just simply says I want jump the bandwagon and make more money. That is a legitimate interest.",Jobs,Australia,Hydro Power
744,Negative,2.5474,If he wants to spend his money going green. And he makes money doing so. I def not stopping him. Whats his stock ticket Ill invest too,Investment,Australia,Hydro Power
745,Neutral,3.0,ASX:FMG,Technology,Australia,Hydro Power
746,Very Negative,1.8012,Fortescue is the only listed entity I'm aware (asx),Investment,Australia,Hydro Power
747,Neutral,3.8808,Finally some good news,Cost,Australia,Hydro Power
748,Negative,2.4536,As believable as apple environment reason for cutting off charger in iphone,Policy,Australia,Hydro Power
749,Neutral,3.843,Namibia's also got a nice investment in green hydrogen.,Technology,Australia,Hydro Power
750,Neutral,3.1544,"You do whatever you want, please dont waste our tax payers money",Tax,Australia,Hydro Power
751,Very Negative,1.8282,All this bullshit instead of using magnetic induction to smelt his ore into steel.,Cost,Australia,Hydro Power
752,Neutral,3.859,"You can make molten iron ore, but that wont help you, you will just be left with a lump of red iron ore rock. You need to remove oxygen before you can create steel. Hydrogen is one way, electrolysis is another.",Technology,Australia,Hydro Power
753,Neutral,3.0,Australian ? Billionaire ?,Tax,Australia,Hydro Power
754,Neutral,3.5464,Well let me use my 20 bucks to kickstart it then. I think billionaires are mostly assholes too but i would rather have them invest in this than into new coal plants,Tax,Australia,Hydro Power
755,Neutral,3.0,He's both of those things.,Policy,Australia,Hydro Power
756,Very Negative,1.8282,Bullshit,Policy,Australia,Hydro Power
757,Negative,2.8456,"No shit. He's investing very heavily into green hydrogen production and into solar (although he's wanting to build shitty thin film) He has self interest of course, making steel green means he still has a product to sell.",Investment,Australia,Hydro Power
758,Very Negative,1.8012,"Translation: Some rich asshole is able to pretend to care enough about Earth to do something, while making billions of dollars and controlling the world's energy market. Fuck this rich piece of shit. He can shove his bullshit gas right up his ass! Fuck this rich scumbag!",Infrastructure,Australia,Hydro Power
759,Positive,4.4192,Kinda sounds like a more extreme version of Elon Musk.,Investment,Australia,Hydro Power
760,Neutral,3.0,Chill out dude.,Policy,Australia,Hydro Power
761,Neutral,3.8038,"No That was Rio Tinto. Andrew Forests company is Fortescue. He is dead set on green hydrogen Australia has a great Solar and Wind profile so if he can come up with a way to produce green hydrogen at scale using renewables he may be onto something. Only issue is the ""at scale""",Cost,Australia,Hydro Power
762,Very Positive,4.9732,"I'll start with a throat-clearing so I am not accused of being a nay-sayer or a hater of hydrogen. I'm an electrical power engineer, clean energy accredited designer, and have more than a passing interest in the stuff. We absolutely 100% need green hydrogen.... BUT... Hydrogen hopium is strong but the physics aren't as enthusiastic as the fossil fuel industry backers of it. Without a doubt green hydrogen has a part to play in a zero emission future, but in my estimations it's future will be limited to using it as a molecule and NOT an energy source or fuel. Green Steel may fit into the former. What I mean by that is we will need green hydrogen to replace the approximately 100 million tons of fossil-derived hydrogen that we currently use in the world, for things like making ammonia for fertiliser, and syngas etc. We absolutely must displace these with green hydrogen but it doesn't account for a huge amount of the world's overall emissions so we need to focus on the big pieces of low hanging fruit first, as we have finite resources, finite money, and not much time to keep kicking the can. Hydrogen is NOT a source of energy. It is a STORE of energy. So you have to make hydrogen from something. You can either reform methane (natural gas) using steam (""black"" or ""blue"" hydrogen), or you can use renewable electricity and water to make ""green"" hydrogen. You can burn the hydrogen for heat energy, or you can run it through a fuel cell to turn it back into electricity. The latter being the most commonly pushed technology. This is an awfully inefficient process. You have to convert electricity into hydrogen gas, compress it to a liquid, transport it, store it, then turn it back into electricity. You lose around two-thirds of the original energy context of the renewable electricity. Its also expensive. As a practical example, what this means is a Tesla 3 BEV is 3 to 4 times more energy efficient, and costs around 5 times less to ""fuel"" per km, than a Toyota Mirai HFCV. This approximate benchmark applies to most other applications where people are pushing green hydrogen as a solution to green energy. If we use hydrogen fuel cells instead of batteries, we will need to generate THREE TIMES as much renewable electricity. This is not small beans. Look at who is backing most of the big hydrogen projects worldwide. Its largely fossil fuel companies. If they were doing it with their own capital I wouldn't care, but they're all seeking public money to do it. Forgive me for being cynical, but it seems like one big bait & switch scheme - sell us the sizzle of green hydrogen, but actually sell us black or blue hydrogen. If it looks like a duck... TLDR: we need to directly electrify whatever we can as quickly as we can, and at the same time building out our grid with solar, wind & hydro. I would say nuclear but I don't think we have time and it's too expensive. But I remain open to the possibility. We need green hydrogen but we need it to replace the existing dirty hydrogen. Much of the hype of hydrogen is vapourware.",Infrastructure,Australia,Hydro Power
763,Neutral,3.0,"Appreciate your thorough reply mate, plenty of food for thought",Jobs,Australia,Hydro Power
764,Neutral,3.5464,Very sensible take. What about shipping? Ships will definitely need hydrogen to decarbonise?,Cost,Australia,Hydro Power
765,Very Positive,4.9244,"TLDR; Twiggy has the capital and knowledge/experience to deliver on this, IMHO if you wanted to place a bet on this (I wouldn't, I'm more broad based ETF dork) then Twiggy would be the safest bet -----Steel and Green Steel----- Steel can be done 2 ways, elec arc furnace (used to recycle) or blast furnace (used with iron ore) 50% of the worlds steel is made in china, most steel in US is recycled not new steel, china is really where new steel is made Hydrogen would be replacing the Blast Furnace which currently uses coal Hydrogen furnaces already exist for other purposes, big steel makers have already made multiple ""We did it!"" announcements but it's like saying ""We did it!"" in regards to building an EV....it's all known technology, of course you could do it, its an achievement and a step forward but we are not waiting for a ""Break-through"", of course you can build a hydrogen furnace for steel making So the whole thing comes down to the cost of hydrogen. -----Hydrogen----- Cheap Green Hydrogen is a waste by-product of renewable energy Sun/Wind doesn't always shine/blow all the time so you need to oversize your system so that on average when it runs at 70% capacity, it's still able to meet 100% of your energy needs Then when it is really windy and sunny and your filling all your storage as fast as you can (Pumpd hydro, batteries, whatever) then the excess gets dumped into electrolysis to split water. The resulting hydrogen is basically free (What else you gonna do with the excess? really, what else could you reasonably do on demand at any time?) Hydrogen is useful as you can; A) Store it for winter energy B) Combine it with nitrogen (Air is mostly nitrogen) = Ammonia Ammonia is an industrial feedstock for many profitable things like making fertiliser, bombs, etc We already handle, store, process large amounts of ammonia, it's fairly stable, can be liquified and transported easily, procedures, policies already exist, CSIRO came up with cool membrane which if you push Ammonia through splits it back into Hydrogen and Nitrogen Ammonia is cool C) Use the Hydrogen in other Industrial process, namely Steel making  Hydrogen is a waste by-product of renewable energy. Long run it's a winner, short term there are cart before horse difficulties but we are already so late that we should probably just push ahead anyway",Infrastructure,Australia,Hydro Power
766,Neutral,3.4046,I appreciate the TLDR at the top of the post. I would like more to follow this. Sound arguments too,Environment,Australia,Hydro Power
767,Neutral,3.68,"Have a look at the work that Anglo American is doing with green hydrogen. Disclaimer, I work for this business - but the legwork they are doing on building hydrogen into the mining value chain is without parallel. They have an operational 220 tonne hydrogen haul truck at a time when manufacturers are only just starting to sign MOUs with mining companies; a pilot solar-hydrogen plant; plans for the first full fleet conversion by 2026, and an objective for conversion of their entire haul truck base. https://youtu.be/s1BUjfbluiY",Investment,Australia,Hydro Power
768,Positive,4.4006,The hype and emotive narrative they are hyping is a turn off.,Cost,Australia,Hydro Power
769,Neutral,3.7224,A bit like a cult leader drawing people in?,Economy,Australia,Hydro Power
770,Positive,4.2248,From a technical perspective we can make green hydrogen and then green steel. From that perspective its solved. The problem is scaling and costs. It simply takes more energy and effort compared to the normal method. If/when steel emissions are regulated only then green steel will become viable. The way I see it is that Twiggy is preparing for this eventuality. So once it's economically viable he's got a head start on everyone. But don't buy into FMG purely from that. The vast vast majority of the company is still iron ore mining.,Cost,Australia,Hydro Power
771,Neutral,3.0,It comes with massive government subsidies. So he makes a shit-tonne of money regardless of the outcome.,Tax,Australia,Hydro Power
772,Neutral,3.9176,"Yes IMO but its a matter of timing. Long term green hydrogen is just printing money but it will probably take a while to get there. With all the climate change regulations coming into place then bankers can start realistically investing in these projects so hopefully it will be sooner (3-5 years) rather than later (5-10 years). My personal opinion only, DYOR",Investment,Australia,Hydro Power
773,Very Positive,4.8674,"Long term its also a commodity, so its not going to generate sustainable super sized profits. Sure, there will be good times and less good times but theyll be dictated by supply and demand rather than anything thats defensible. No doubt there is opportunity to make money as an investor, but BYO thesis know why youre in, know why youll sell, stick to it and dont succumb to hubris.",Cost,Australia,Hydro Power
774,Positive,4.4192,I am hopeful it works if only for the benefit of the environment impact,Environment,Australia,Hydro Power
775,Neutral,3.7224,I invested in the company as I like what I am hearing and a pivot towards a new business area. It may not work but I am taking the punt on it.,Investment,Australia,Hydro Power
776,Neutral,3.8808,Buy them for the fantastic steel/iron ore producer that they are. They produce it cheaper than anyone else. The green hydrogen side of this could be good for the future but its not the sole reason I invested in them.,Cost,Australia,Hydro Power
777,Very Positive,4.5434,They talk about the green side of the business being FFI fortescue future investment Will this company get spun off as a seperate business in the future away from FMG ?,Technology,Australia,Hydro Power
778,Neutral,3.5464,I was wondering that as well Unless the steel mill will be FMG? As per the metals group name vs mining group??,Infrastructure,Australia,Hydro Power
779,Neutral,3.0,Twiggy is a business man and everything he is doing is to grow his pockets knowing that he has more buy power than a lot of others looking to enter the market,Investment,Australia,Hydro Power
780,Very Positive,4.711,"I think its easier for him to foray into the area on the back of billions for dollars in personal wealth gained from the burning of fossil fuels to extract a non renewable resource from the ground. Without new legislation I can see very few projects being feasable, maybe the primo hydro sites.",Tax,Australia,Hydro Power
781,Neutral,3.8038,Has australia ever seized any opportunity at the right time?,Investment,Australia,Hydro Power
782,Neutral,3.0,Womens voting rights?,Economy,Australia,Hydro Power
783,Very Positive,4.744,We're great at flogging off everything not bolted down to overseas companies who make profit? That's uh.. Something we're good at I guess?,Tax,Australia,Hydro Power
784,Positive,4.0212,"Spoiler alert....... Australia will dither, hold committee's and then use it as a political football for the next few years.",Jobs,Australia,Hydro Power
785,Neutral,3.0,While digging up coal and pumping out gas.,Economy,Australia,Hydro Power
786,Neutral,3.8038,"This is an industry puff-piece. One of the ""experts"" being quoted credulously by the ""lefty"" Guardian here is Matt Hingerty, former long-time CEO and MD of Barton Deakin, an ""openly partisan"" government relations and ""lobbying"" firm. This was preceded by roles as Chief of Staff for a former NSW nationals leader, Managing Director for a tourism industry body at the time Scott Morrisson was Managing Director of Tourism Australia, and a Chief of Staff role for Joe Hockey. That's without touching on the rest of those offering their opinion to this former BusinessDay Managing Editor for Fairfax.",Cost,Australia,Hydro Power
787,Neutral,3.256,The answer 20 years ago was nuclear for the next 30 to 40 years. I fail to see how the collective Australian mind can come to a good decision about energy.,Cost,Australia,Hydro Power
788,Positive,4.2738,"Mining interests will use their considerable resources to influence our politicians. The destruction of the mining super profits tax demonstrates how much power it has. If there's to be reform, the mining lobby's influence needs to be destroyed or severely curtailed. Simply putting pressure on Labor is insufficient.",Tax,Australia,Hydro Power
789,Neutral,3.8038,Hydrogen is not clean if produced with fossil fuels. Don't buy into the greenwashing scam.,Cost,Australia,Hydro Power
790,Neutral,3.0,Green/white hydrogen is the only way to go ? ?,Environment,Australia,Hydro Power
791,Neutral,3.8038,'expert' or 'salesman'? the case for hydrogen is stupid...batteries can do pretty much everything cheaper and better.,Cost,Australia,Hydro Power
792,Very Positive,4.6962,"Hydrogen is the logical fuel replacement for long haul routes not logistically serviceable via rail. Batterys unless we have an orders of magnitude increase in power density are unable to adequately supply long distance haulage. Remember for every ton of batteries is a ton less of cargo. One of the benefits to hydrogen is its compatible with EV technology, youre just using a different energy storage method so theyre complementary technologies. WA Is investing heavily into Green hydrogen Generation for use as energy storage and for use in coal free steel in the Pilbara with 800% of our current national energy needs planned in generating capacity. Hydrogen is only expensive because its not being mass produced, hey presto mass production solves this. Hydrogen also solves the gap issue with renewable power generation, when there minimal wind and solar generation you can use the hydrogen generated using the previous excess solar and wind to fill the gap until wind and solar picks up again, currently the system would be to fire up more gas in the turbines. Continuing the reliance on fossil fuels.",Cost,Australia,Hydro Power
793,Neutral,3.8808,How is battery better and cheaper? And this question comes from a automotive battery sales rep.,Infrastructure,Australia,Hydro Power
794,Neutral,3.9176,"The cost of producing hydrogen outweighs its benefits, experts say.",Cost,Australia,Hydro Power
795,Very Negative,1.4106,"Will we do that? No chance in hell. Albo's mob are still scared of their shadow....you can hardly blame them, they've been well trained by the fickle electorate and the corrupt media, but they won't be sticking their neck out any time soon.",Tax,Australia,Hydro Power
796,Very Negative,1.9788,"Anyone who talk about H2 as a fuel is either a liar, innumerate or a scammer or possibly all three.",Policy,Australia,Hydro Power
797,Negative,2.6938,We will miss this....the LNP will rally against it and Labor will loose their balls,Cost,Australia,Hydro Power
798,Positive,4.3194,"If someone produced a million tonnes of hydrogen tomorrow, what would we do with it? Could we store it? No. Is there a use for it? No. I believe there are only a couple of vehicles in the country that could use it. If we had a thousand hydrogen cars, could they use the gas? No, because there's no distribution system. But there is electricity. It's available everywhere. There are already thousands of EV's to use it. Much better, if the Government incentivised the uptake of EV's, say, by way of subsidies, tax deductions, or registration reduction.",Tax,Australia,Hydro Power
799,Neutral,3.592,"You have a point, but this does miss that there are already industries that use millions of tonnes per annum of grey hydrogen (from methane) as a feedstock - primarily fertilisers, explosives, and refineries. Even just replacing this with your million tonnes of H2 would be a huge decarbonisation benefit. Problem is, its not cost effective to do so when competing in fossil-based global fertiliser supply chains.",Technology,Australia,Hydro Power
800,Very Negative,1.2086,"A sad sales pitch to get taxpayer funds into the wrong private hands. Hydrogen isn't economical as other green fuels. Hydrogen has an efficiency of around 30% maximum when compared to electricity EV at 90-95%. No industry is stupid enough to pay 3x as much for it's fuel. It's 3x more expensive than 'green' diesel (co2 offset diesel) The compression and storage systems we have that brittle, rupture and explode trying to contain the smallest molecule in the universe have been working on since the 50's with billions already sunk into it with zero improvements in containment. It still leaks. And it still explodes. Australia has no local advantage in its production (green hydrogen) because all it needs is power and water. Every country has access to power and water. Why make it here to ship it (adding costs to it) when other countries, if it was viable, can make it locally? It's been proven by researchers hundreds of times to be a dead-end technology. The only economic case found has been in the world mandates hydrogen use 100% for industry and 50% for transport energy and then for some dumb reason they buy it from us because they don't have power or water over our LNG export quantities. Heavy haulage has found electric hot swap or carbon offset diesel is much much much cheaper. There's a host of other technical issues suffice to say there have now been a half dozen hydrogen fueling station explosions and some countries have banned it because after independent review it became obvious that it doesn't work. All car manufacturers have stopped plans and dumped tech for mass production of hydrogen cars. Fun fact, the LPG system we have was government paid, and there are something like 1000 LPG cars in all of Australia now. If we sink billions and billions into it, the final product because the economics are so much better in any industry, will be service stations all having a little hydrogen tank that the government has to service using taxes to maintain the 1000 hydrogen cars that get purchased around australia for the next 30 years. A stupid investment with 0 return. Meanwhile, we have to endure 30 years of sky news and Murdoch screaming that Labors stupid for not investing and creating a new oil and gas industry that leaves us economically uncompetitive against other countries.",Infrastructure,Australia,Hydro Power
801,Very Positive,4.6962,"""Green"" Hydrogen is a deception. It offers the best opportunities to divert finances, eg government money, in ways where it can be manipulated for , let's say alternate, purposes. Huge amounts. Billions $$$",Tax,Australia,Hydro Power
802,Positive,4.1148,"If the ""green left crowd"" actually wanted energy rationing, all they'd have to do is wait a few years - Australia, and much of the western world, is on the cusp of not having sufficient energy because ""capitalism"" has failed to increase capacity with existing technology, or plan for renewal/refurbishment/replacement of already-existing capacity. Let alone being hugely resistant to alternatives...",Tax,Australia,Hydro Power
803,Neutral,3.0,Username checks out.,Cost,Australia,Hydro Power
804,Neutral,3.0,It's still not practical and most of the hydrogen produced is still through the steam reformation of oil and so it's really just more fossil fuel green washing,Environment,Australia,Hydro Power
