,Sentiment,Sent_Scale,Text,Topic Key,Country,Type of Resources
0,Positive,4.0,exec summary australia announces new subsidy policy renewable energy manufacturing policy aim bolster local production renewable energy equipment includes subsidy manufacturing facility producing solar panel wind turbine battery,Policy,Australia,Solar Energy
1,Very Negative,1.0,afr shamelessly maintains role dupe renewables subsidy seeker keep financially solvent report australia cd share million new renewable energy job subsidy cost billion year destroy low cost energy httpsafrcomcompaniesenergyrenewablesofferpostpandemicjobsboomp,Tax,Australia,Other
2,Very Negative,1.0,want australia fossil fuel subsidy billionyear ten time greater renewable energy subsidy billionyear know vote budget repair,Tax,Australia,Other
3,Positive,4.0,dr helen haines independent mp indi victoria introduced bill parliament seek include home battery system australia existing renewable energy subsidy scheme renewables,Tax,Australia,Other
4,Very Negative,1.0,australia subsidy didnt cutthe govmnt crony wood pellet industry get renewable energy subsidyffs old growth forest renewablethe govmnt cannot show single one industry must outlawed globally httpsxcombeanearthnutstatus,Economy,Australia,Other
5,Very Positive,5.0,largescale renewableenergy target market data australia largescale renewable energy target creates financial incentive installation renewable energy power station target designed reduce emission electricity sector encourage,Economy,Australia,Other
6,Very Negative,1.0,australia energy security board proposed controversial coalkeeper subsidy according cleanenergy advocate payment could cost consumer billion year undermine future cleanenergy investment,Tax,Australia,Other
7,Very Positive,5.0,australia successfully transitioned renewable energy driven mostly private sector subsidy,Tax,Australia,Other
8,Very Negative,1.0,annual subsidy renewable energy australia billion,Tax,Australia,Other
9,Very Positive,5.0,swapping fossil fuelled device energy source renewablebacked electrification fastest cost effective way decarbonise domestic economy,Economy,Australia,Other
10,Very Positive,5.0,happy first birthday one first piece legislation introduced albanese government climate change bill put australia course net zero emission future renewable energy superpower,Policy,Australia,Other
11,Very Positive,5.0,perfect insanity australia renewable energy policy guarantee blackout rocketing price,Policy,Australia,Other
12,Neutral,3.0,senator david van stance energy policy somewhat mixed voted consistently increasing investment renewable energy twitter criticized labor government energy policy belief making australia poor destination investment,Policy,Australia,Other
13,Negative,2.0,midtosenior level government official working climate change energy policy practice research reform offering unique climatechange professional short course grid integration renewable energy participant iora member state,Policy,Australia,Other
14,Very Negative,1.0,climate policy worked renewable energy target policy incentivise company offset emission doesnt work simple either delay decarbonise currently delaying elizalittleton explains auspol,Policy,Australia,Other
15,Very Negative,1.0,nuclear energy scientist say victim cancel culture engineer australia called scheduled pronuclear speech following pressure renewable energy advocate simon holmes court,Other,Australia,Nuclear Energy
16,Positive,4.0,arenawire ieas australia energy policy review commends australia recent progress toward sustainable renewable energy future say lot work still needed complete job httpsarenagovaubloghowtheiearatesaustraliasenergytransition,Policy,Australia,Other
17,Very Negative,1.0,there angry people inside renewable energy resistance regional australia appeasing noisy minority climate science denier fear loss amenity would poor public policy albomp jacintaallanmp,Policy,Australia,Other
18,Very Positive,5.0,renewables today case study australia renewables future australia currently renewable electricity mostly solar wind causing wholesale spot price change destabilizing grid current policy,Policy,Australia,Other
19,Very Positive,5.0,rba deputy talk renewable energy potential watch russia australia going renewable energy superpower whatever mean,Other,Australia,Other
20,Very Negative,1.0,dutton promise energy solution nuclear policy httpspvmagazineaustraliacomduttonpromisesenergysolutionsnuclearpolicystillleavesaustraliansindarkutmsourcespsutmmediumtwitterausolarnews solarrevolution solarsustainability,Policy,Australia,Nuclear Energy
21,Very Positive,5.0,past two day edge convention centre proud host clean energy conference incredible event brought together energy professional australia africa beyond engage meaningful discussion renewable energy policy investment,Policy,Australia,Other
22,Very Positive,5.0,five day away industry climate action summit bringing together policymakers renewable energy thought leader responsbile investment group australia biggest business tackling climate change take cooperative action industryclimateaction,Policy,Australia,Other
23,Very Positive,5.0,industry climate action summit underway today australia prominent policymakers big business responsible investor renewable energy thought leader converging harness major economicjob benefit tackling climate change industryclimateaction,Policy,Australia,Other
24,Very Positive,5.0,albanese government plan turbocharge development renewable energy described landmark policy nation transition away fossil fuel broadly welcomed industry state government httpstheguardiancomaustralianewsnovalbanesegovernmentrenewableenergyinvestmentschemecmpsharebtntw auspol nswpol,Policy,Australia,Other
25,Very Negative,1.0,stealth boondoggle peter obrien spectator australia may ndis public policy albatross initiated worthiest intention allowed mutate massive boondoggle one right australia becoming renewable energy,Policy,Australia,Other
26,Negative,2.0,first nation clean energy network work cut come policy reform given complex nature australia renewable energy regulatory framework thats karrina nolan talking ah yep via ecogen httpsecogenerationcomaufirstnationscleanenergyharnessingthecollectivepowerofindigenouscommunitiesfirstnations indigenous renewableenergy,Policy,Australia,Other
27,Neutral,3.0,australia need policy market clarity reach ambitious attainable renewable energy target,Policy,Australia,Other
28,Very Positive,5.0,australia energy future nation building future generation labor need come clean today tell u much renewable policy cost billion paid overseas company land owner millionaire bloombergnef estimate,Policy,Australia,Other
29,Very Negative,1.0,south australia renewable energy emission reduction ambition first announced target incorporated legislation widely derided unachievable sa instead overachieved international pacesetter climategroup theausinstitute,Policy,Australia,Other
30,Neutral,3.0,australia need policy market clarity reach ambitious attainable renewable energy target,Policy,Australia,Other
31,Very Positive,5.0,australia energy future nation building future generation labor need come clean today tell u much renewable policy cost billion paid overseas company land owner millionaire bloombergnef estimate,Policy,Australia,Other
32,Very Negative,1.0,south australia renewable energy emission reduction ambition first announced target incorporated legislation widely derided unachievable sa instead overachieved international pacesetter climategroup theausinstitute,Policy,Australia,Other
33,Very Positive,5.0,climate risk minister industry australia clean energy transition collaboration asean country australia focused becoming renewable energy superpower legislation targeted measure reduce energy price setting ambitious emission,Policy,Australia,Other
34,Positive,4.0,according afp news agency australia prime minister unveiled plan overhaul economy invest green energy initiative signal significant shift australia economic policy focus sustainability renewable energy source,Policy,Australia,Other
35,Very Negative,1.0,brookfield emerge largest owner operator renewable energy australia unveiling billion bid buy france neoen six month origin energy shareholder dismissed takeover offer,Other,Australia,Other
36,Positive,4.0,esg policy updateaustralia,Policy,Australia,Other
37,Very Negative,1.0,perfect example fundamentally unserious australian politics rolling nuclear energy australia would expensive decade long process meanwhile cost renewable energy falling like rock energy policy chosen based culture war nonsense,Policy,Australia,Nuclear Energy
38,Very Negative,1.0,anyone basic energy knowledge know nuclear stupidly expensive make sense australia coalition nuclear policy way trying delay renewable energy grid,Policy,Australia,Nuclear Energy
39,Very Positive,5.0,change government policy drive improved return stage one waroona renewable energy project frontierasx investing,Policy,Australia,Other
40,Very Positive,5.0,portugal australia share ambitious renewable energy climate change policy setting lot opportunity cooperate great discussion chair environment energy committee parliament tiago brando rodrigues assembleiarepub,Policy,Australia,Other
41,Very Positive,5.0,cop climate summit bowled plethora pledge renewable energy health agriculture australia signed biggies,Environment,Australia,Other
42,Very Negative,1.0,mp speech spark walkout energy event httpssunshinecoastnewscomaumpsspeechsparkswalkoutatenergyevent via sunshine coast news clean energy council queensland policy impact director tracey stinson also told attendee renewable energy making growing impact australia energytransition auspol,Policy,Australia,Other
43,Positive,4.0,monday australia wa delegation visited sydneyunis u study centre panel shared australian clean energy finance policy strategy panel discussed emerging rd rep pnnlab amp renewableh speaking wsuaustralia gocougs,Policy,Australia,Other
44,Negative,2.0,cost living crisis australia primarily driven absentese govts renewable energy policy ir policy make nigh impossible far dangerous hire casuals fear legal repercussion drive unemployment welfare demand,Policy,Australia,Other
45,Positive,4.0,electric ute perfectly suited driving regional australia country need policy change public charger encourage transport trend according renewable energy group httpssmartcompanycomauindustriestransportlogisticselectricuteschargersneededregionaltowns,Policy,Australia,Other
46,Positive,4.0,sri lanka eye south australia energy transition policy president wickremesinghe explores renewable energy green hydrogen sustainable future energytransition renewableenergy read,Policy,Australia,Other
47,Very Positive,5.0,target tender australia bold move towards renewable energy exploring shift energy policy use contractsfordifference achieve ambitious emission reduction goal learn httpsbarclaypearcecomaublogtargetsouttendersintoachieverenewableenergygoals renewableenergy climateaction cop,Policy,Australia,Other
48,Very Positive,5.0,ret still best time renew australia renewable energy policy,Policy,Australia,Other
49,Positive,4.0,aggressive policy move united state fasttrack renewable energy industry namely u billion inflation reduction act could drastically undermine australia future green hydrogen export unless urgent publicprivate action taken httpsreneweconomycomauaustraliariskslosingoutinglobalgreenhydrogenraceasusspeedsaheadamp,Policy,Australia,Other
50,Positive,4.0,need renewable gas target next policy step needed hydrogen australia take look httpsenergynetworkscomaunewsrenewablegastarget,Policy,Australia,Other
51,Very Positive,5.0,tomorrow fed budget govs chance lay foundation australia renewable energy critical mineral superpower albomp gov look set commit future made australia policy key commitment smart energy budget contd,Policy,Australia,Other
52,Very Negative,1.0,australia significantly bolster green energy investment australia plan dramatically expand policy lure renewable energy investment co weather qnewshub qnewscrunch httpsqnewscrunchcomweatheraustraliatosignificantlybolstergreenenergyinvestment,Policy,Australia,Other
53,Positive,4.0,australia new policy direction climate change albanese government must consolidated working closely foreign partner like south korea japan renewable energy transition writes theo mendez httpgounimelbeduauss,Policy,Australia,Other
54,Very Negative,1.0,australia government empowering trade union boosting social welfare reviving industry policy putting clamp gas producer using regulation taxpayer fund accelerate transition renewable energy tear bedtime httpstheaustraliancomaucommentaryjimchalmersplayingthelonggamewithintricatemakeoveroffinancialfoodchainnewsstoryfecffdcbedfbdac,Policy,Australia,Other
55,Very Positive,5.0,even shift renewable energy ndis responsible australia productivity problem,Other,Australia,Other
56,Very Positive,5.0,australia incredible city beautiful liveable sustainable place mean investing public transport green space affordable housing renewable energy universal climate impact safety net,Environment,Australia,Other
57,Positive,4.0,energy minister chris bowen codeveloping first nation clean energy strategy bowen point project canada involving indigenous people big proportion canada renewable energy actually owned first nation people auspol,Policy,Australia,Other
58,Very Negative,1.0,perfect insanity australia renewable energy policy guarantee blackout rocketing price httpiowaclimateorgperfectinsanityaustraliasrenewableenergypolicyguaranteesblackoutsrocketingprices,Policy,Australia,Other
59,Very Positive,5.0,great catch ohad blumberg israel trade commissioner australia utsengage talked trade start ups r innovation renewable energy he smart guy great grasp business need trade industry policy israelmfa,Policy,Australia,Other
60,Very Positive,5.0,australianbritish multinational mining metal petroleum company bhp signed memorandum understanding mou toyota australia enhance safety implement decarbonization measure within bhps australian operation httpetaacomtr,Other,Australia,Other
61,Positive,4.0,simple analysis today electricity price v nuclearpowered australia via tristanedis fin short even scrap govts renewable energy program still pay substantially nuclear httpsafrcompolicyenergyandclimatehowmuchcouldyousaveifyouwentnuclearpfdyq,Policy,Australia,Nuclear Energy
62,Very Negative,1.0,billion sun cable crash setback doesnt spell end australia renewable energy export dream,Other,Australia,Other
63,Very Negative,1.0,indonesia permit power wheeling indonesia new renewable energy bill include legislation allowing power wheeling enabling private company sell electricity directly end consumer via network owned httpdlvrittdyj renewables australia solarenergy,Policy,Australia,Other
64,Very Negative,1.0,investor look offshore red tape threatens australian renewables target fasttrack approval legislation new zealand catching eye renewable energy investor australia amid concern bureaucratic httpdlvrittcvmf renewables australia technology,Policy,Australia,Other
65,Very Negative,1.0,australia announces new subsidy policy renewable energy manufacturing australian federal government unveiled plan future made australia act proposing taxpayerfunded incentive httpdlvrittmt market modulesupstreammanufacturing battery,Policy,Australia,Other
66,Neutral,3.0,u know green gold kangaroo health foundation tick australia hydrogen guarantee origin scheme would work much way important tool policy toolbox support transition renewable gas,Policy,Australia,Other
67,Very Negative,1.0,australia industrial policy dirty word meaning protectionism picking winner instead advocate pushing bn renewable energy package billed statecraft might relevant sa,Policy,Australia,Other
68,Negative,2.0,big proportion canada renewable energy owned first nation people much bigger australia want see much bowenchris via conversationedu httpstheconversationcomgrattanonfridaycanthealbanesegovernmentshowmuscleinindigenouspolicyonetestiscomingnextweekfbclidiwarhtkqoebwjtbohrdmwvaakvkwvtjjbagohosvyqpfmcfukm firstnations aboriginal indigenous torresstraitislander,Policy,Australia,Other
69,Very Positive,5.0,significant investment batterystorage budget ensure new renewable generation firmed electricity supply always meet demand increasingly green grid mark mcgowan west australia energy network overhaul,Investment,Australia,Other
70,Very Negative,1.0,world transitioning decarbonised world trillion invested renewable energy worldwide australia need policy certainty big institutional investor invest otherwise simply miss boat decarbonisenow,Policy,Australia,Other
71,Positive,4.0,nuclear safe reliable energy source cheaper renewable energy many country use nuclear energy ci provided concise answer question australia examines energy policy going forward httpsenergycisorgau cisoz,Policy,Australia,Nuclear Energy
72,Neutral,3.0,peter duttons budget reply third didnt include single energy policy three albomp budget reply outlined plan rewiring nation green energy apprentice powering australia comprehensive plan reducing emission renewable energy,Policy,Australia,Other
73,Positive,4.0,investor group climate change annual survey show investor confident australia climate energy policy seeing renewable energy solid longterm investment less want invest nuclear energy,Policy,Australia,Nuclear Energy
74,Positive,4.0,stable predictable policy environment essential attracting retaining significant capital required achieve renewable energy target said said marilyne crestias interim chief executive clean energy investor group,Policy,Australia,Other
75,Neutral,3.0,australia plan dramatically expand policy lure renewable energy investment country climate energy minister chris bowen say,Policy,Australia,Other
76,Very Positive,5.0,weve big week parliament week two important legislation passing state parliament hydrogen renewable energy bill adelaide university bill form part bold ambitious agenda south australia,Policy,Australia,Other
77,Very Positive,5.0,energy one welcome australia decision replace renewable energy target ret auction showing government dedication tboosting deployment renewable energy project leading increased demand innovative solution,Policy,Australia,Other
78,Very Positive,5.0,excellent piece proposed audbillion australian renewable industry package respond global clean energy transition australia need new green energy statecraft industry policy needed make sure comparative advantage becomes competitive advantage alexandermhynd,Policy,Australia,Other
79,Very Positive,5.0,future made aust policy renewable energy superpower ive calling ambitious ira response includes tax credit devil budget detail must include incentive smaller aust battery solar renewable manufacturer auspol,Policy,Australia,Other
80,Very Negative,1.0,australia cannot run renewable energy alone net zero zealot going fill gap reality ideology httpsspectatorcomauafreshapproachtoenergypolicy,Policy,Australia,Other
81,Positive,4.0,peter dutton want nuclear energy opposition leader peter dutton poised unveil coalition nuclear energy policy ahead may budget move come australia grapple challenge transitioning renewable energy source achieving netzero,Policy,Australia,Nuclear Energy
82,Positive,4.0,report kpmg produced behalf energy network australia identifys suite potential supportive policy enable renewable gas part australia decarbonisation effort take look,Other,Australia,Other
83,Positive,4.0,federalbudget ausgovs chance lay foundation au renewable energy critical mineral superpower albomps future made australia act key policy driver sure read full medium release httpssmartenergyorgauarticleswhatdoesasmartenergybudgetlooklike jechalmers,Policy,Australia,Other
84,Very Positive,5.0,via reneweconomy ret still best time renew australia renewable energy policy,Policy,Australia,Other
85,Neutral,3.0,australia plan dramatically expand policy lure renewable energy investment country climate energy minister chris bowen say,Policy,Australia,Other
86,Very Negative,1.0,australia record number renewable projectsthat cant plug reason weve failed adequately invest infrastructure policy setting encouraged offsetting rather genuine decarbonisation crikeynews w rodc httpscrikeycomaurenewableenergybacklogcarbonoffsetssumdfpterbngfynvrpnbgzedpmnraut,Policy,Australia,Other
87,Very Positive,5.0,policy action need legislation supporting energy transition opportunity adopting renewable energy technology south africa cnbcafrica themba mkhwanazi anglo american regional director africa australia tune today,Policy,Australia,Other
88,Negative,2.0,labor grand emission goal failing fast amid slowing new renewable energy investment eyewatering cost blowout growing community resistance new wind solar transmission line writes nick cater,Jobs,Australia,Other
89,Negative,2.0,investor combined trillion asset becoming optimistic australia climate policy roughly half considering financing renewableenergy project according extract survey httpstribalgufhmdm,Policy,Australia,Other
90,Very Negative,1.0,shadow infrastructure minister bridget mckenzie say albanese labor government refusing accept reality come energy policy renewable energy plan,Policy,Australia,Other
91,Very Negative,1.0,dan tehan taken aim government renewable energy target arguing recent decision block crucial offshore wind strategy victoria show labor plan complete disaster,Policy,Australia,Other
92,Positive,4.0,treasurer jim chalmers discusses albanese government future made australia bill aim make country renewable energy superpower,Policy,Australia,Other
93,Neutral,3.0,australia plan dramatically expand policy lure renewable energy investment country climate energy minister chris bowen say,Policy,Australia,Other
94,Very Negative,1.0,renewable energy policy australia listen former ausgov federal policy advisor describing subsidy green energy policy financially unsustainable dont supply large scale energy need leading eco disaster,Policy,Australia,Other
95,Neutral,3.0,australia plan dramatically expand policy lure renewable energy investment country climate energy minister chris bowen say,Policy,Australia,Other
96,Very Negative,1.0,one surprised renewable rent seeker corporate sector panicking prospect australia embracing nuclear energy,Other,Australia,Nuclear Energy
97,Very Negative,1.0,one surprised renewable rent seeker corporate sector panicking prospect australia embracing nuclear energy,Other,Australia,Nuclear Energy
98,Neutral,3.0,ultimately two type people comment energy australia understand need hour storage get renewable energy think gut feel set energy policy,Policy,Australia,Other
99,Very Negative,1.0,coalition turned renewable energy denial nuclear roadmap nowhere exhausting adam morton,Other,Australia,Nuclear Energy
100,Positive,4.0,peter dutton david littleproud qld lnp dominated coalition pleased see nuclear energy policy starting impact renewable energy investment auspol,Policy,Australia,Nuclear Energy
101,Very Negative,1.0,person australia doesnt know wind solar dearest form energy seen rest world blackout bowen mentally unfit anywhere near climate policy,Policy,Australia,Other
102,Positive,4.0,exec summary australia announces new subsidy policy renewable energy manufacturing policy aim bolster local production renewable energy equipment includes subsidy manufacturing facility producing solar panel wind turbine battery,Policy,Australia,Solar Energy
103,Very Positive,5.0,rt cleannrgcouncil australia need policy regulatory reform accelerate deployment clean energy storage given importance maintaining reliability security power system delivering lowcost renewable energy consumer,Policy,Australia,Other
104,Very Positive,5.0,rt cleannrgcouncil australia ret met policy delivered much abatement given much certainty unlocked investment extending beyond would simple fast lower energy price far outweigh cost associated,Policy,Australia,Other
105,Very Negative,1.0,stupidity australia electricity policy maker oversupply wind solar generation early retirement coal real possibility baseload gas generation preparing spend billion unnecessary transmission doubling wind solar,Policy,Australia,Other
106,Very Positive,5.0,rt cleannrgcouncil clean energy industry booming australia transition renewable energy unique opportunity policy officer work critical transformative issue renewable sector learn apply,Policy,Australia,Other
107,Very Positive,5.0,five thing make australia get energy policy track battery high voltage cable solar panel wind tower electric heavy vehicle two big thing achieve climateaction jobcreation,Policy,Australia,Solar Energy
108,Very Negative,1.0,assume productivity commission shitbag alternative government hellishly expensive inefficient nuclear energy plan gusto shitbagged make australia solar panel policy current government,Policy,Australia,Solar Energy
109,Positive,4.0,solar panel wind turbine energy storage must rolled rapidly possible must allow duttons policy detour distract task read latest fellow johnquiggin,Policy,Australia,Solar Energy
110,Very Positive,5.0,australia leading way highly replicable approach solar wind energy nntc advocating policy change carol schwartz named climate council new chair latest renewables edition httpsmeralliprojectscomauweeklywrapup solarnews solar solarpv energynews,Policy,Australia,Wind Energy
111,Very Negative,1.0,eu worldleading example genuine policy reform show way httpsnewsmongabaycomaustraliarejectsforestbiomassinfirstblowtowoodpelletindustry australia total energy mix came renewables solar wind hydro came burning biogas non woody biomass bigbadbiomass,Policy,Australia,Bioenergy
112,Very Positive,5.0,australia already world leader rooftop solar right policy lever also lead world home energy storage,Policy,Australia,Other
