,Sentiment,Sent_Scale,Text,Topic Key,Country,Type of Resources
1252,Negative,2.7946,"Every situation is different but we pay zero for electricity- had bills of about $600-$800 a quarter. Run 2 fridges, many screens. We produce more than we need. Invest sooner than later.",Investment,Australia,Solar Energy
1253,Very Positive,4.7926,"Depends on your area, how much trees shade your panels etc. Your bills will be negative in the summer but you'll still pay in winter. Used to be much better feed in tarrifs around 18c but now the best deals are around 10 which makes less worthwhile. Prices will only go up so it's almost certainly worth it if you can afford the 3-6k outlay",Cost,Australia,Solar Energy
1254,Neutral,3.0,"Yes, cause the landlord put them on the place rentingdidnt ask for it either.",Cost,Australia,Solar Energy
1255,Neutral,3.256,"We had solar panels and a battery system installed in December 2021. My mum has always paid into the power bill fortnightly but has recently had to cut her payment down to $25 a fortnight because we were over $500 in credit. This year to date weve used 88% of our power usage from solar and the battery, so just 12% from the grid.",Cost,Australia,Solar Energy
1256,Neutral,3.6364,"a no brainer, batteries are not there yet but solar will pay itself off, specially if prices of electricity keeps going up.",Investment,Australia,Solar Energy
1257,Very Positive,4.5434,It honestly depends on your home. How much sun do you get? How much power do you use? When do you use that power? Do you have money for it or will you be taking out a loan? What Tarrifs can you get? What cashback offers etc can you get from an installer? Can you ensure they'll still be around to honour warranties? All questions you need answers to.,Infrastructure,Australia,Solar Energy
1258,Neutral,3.6364,One thing to consider is if you are on gas. Because you aren't going to see a huge difference if your hot water and stove are gas.,Cost,Australia,Solar Energy
1259,Very Positive,4.7958,The feed in tariffs are only going to go down and the price for electricity is only going to go up each year. Its definitely not the life changer it once was but it does makes a dent in your bill. Most solar companies should ask for your last bill or two and calculate how long it will take you to pay the system off so to speak. This is a pretty rough estimate but is usually not far off. There are other ways to save money on bills e.g more efficient lighting and appliances etc. if you arent sure that solar is the right fit.,Cost,Australia,Solar Energy
1260,Positive,4.4362,"Upgraded our system about 18 months ago after replacing our roof. Went for a larger system with battery, as we have a smart meter with time of use pricing, so wouldve had to export a whole lot more during the day to match what wed be buying in at night. Have only had one bill since not in credit, and that was only because our credit had gotten too high and theyd refunded it to us without warning, during a period with higher use (winter when running ducted at night). On the plus side, when we lost power recently for almost 24hrs, battery ensured we had lights plus a couple of power circuits overnight, and solar kept us going during the day, so lost no food, still had internet etc while everyone else in our area without battery had nothing the whole time. That alone made it worthwhile.",Infrastructure,Australia,Solar Energy
1261,Positive,4.1218,"yes one word ""Blackouts"" this summer is going to be hot and there is going to be blackouts and you dont want to be stuck with no electricity in the god damn heat while people with solar panels dont worry about blackouts and are able to keep cool.",Infrastructure,Australia,Solar Energy
1262,Neutral,3.8038,"Solar panels dont help at all when theres a blackout, grids out, inverters typically shutdown. Can be different I believe with battery systems, some but not all..",Cost,Australia,Solar Energy
1263,Very Positive,4.7868,"Got a 6.66kw system installed a-few years ago. Day like today it produces around 40kws. I saw significant reduction. (Have got into $300 credit during summer bill period two of the years) I actually got another 6.66kw system installed today and two 5.4kw batteries so ill circle back with how its all going for my next bill period, being summer I expect to be impressed. Given how happy I was with my first system it was a no brainer to get another.",Policy,Australia,Solar Energy
1264,Very Positive,4.5434,"Absolutely worth it! Installed $8700 system 5 years ago. Payback period was about 4 years. Now I'm just enjoying credit bills every month! The electricity retailer is literally giving me money every month, not the other way around, and it's awesome lol As one of us is a stay at home parent, the dishwasher, washing machine and dryer run during the day time.",Cost,Australia,Solar Energy
1265,Very Positive,4.6542,"I got it installed in November 2019. For the first two years my credits would cover my winter bills. Essentially it was two years with no out of pocket. Once they dropped the FIT to 8c I started getting bills in winter. Ranging from $90-160 a month. Over summer my bills are $10-$30 per month. This is a two person household with everything on electric. My system cost me 5. 5k, 5kw inverter. With all that said, I am mindful of my usage, but not a Scrooge. If you blast your ac on at night time or turn on the dishwasher it's gonna cost money regardless of how big your system is. Some habits need to change. Overall I'd say it was a worthwhile investment for me",Infrastructure,Australia,Solar Energy
1266,Very Positive,4.6804,"Definitely helps with bills, plus it adds equity to the house. Bit like the fake trellis, adds a bit of charm.",Cost,Australia,Solar Energy
1267,Neutral,3.2054,"Short answer, yes. https://www.solarquotes.com.au/solar101.html#solar-savings-payback Long answer, yes and get a battery. Start your research here: https://www.solarquotes.com.au/ with the tariff rates gone down. That depends. Yes there are people on legacy rates of the distributor feed-in tariff - fixed at 44c per kWh for another 5 years. I'm with AGL - Five years ago my FIT was just over 16 cents; by the time the new plans came in at the end of June this year it dropped to 5 cents; I changed plans [still with AGL] and am now on 15 cents.",Infrastructure,Australia,Solar Energy
1268,Neutral,3.7224,Thank you for the links.,Technology,Australia,Solar Energy
1269,Positive,4.2498,When I was on 44c I was always in credit. Always. Now I've moved house and I'm on like 12c tariff with 8.8kw array and I'm averaging about $450 per quarter. We use a lot of power during non-generating hours. Need to organise a battery.,Cost,Australia,Solar Energy
1270,Very Positive,4.5426,"Yep totally worth it - do the washing, vacuuming and put the dishwasher on during the day while electricity is free- were looking at getting more panels and a battery as we intend on getting an EV for next car.",Cost,Australia,Solar Energy
1271,Negative,2.6442,"I'm in WA single person household, I got panels installed in July this year (6.6kW with 5kW inverter) so I have had only two billing cycles. I get 2.25c per kW exported between sunrise and 3pm, from 3pm to sunset it is 10c. I've moved as much of my power use to the daytime (dishwasher, laundry, cooking on the weekend) and so far 50% of my consumption comes from my panels, I hopefully might see that increase a little more when I start running the aircon during the hot days. My expected payback even with the low tariff rates is <10 years",Cost,Australia,Solar Energy
1272,Very Negative,1.7032,"all those saying yeah definitely worth it lol.... dont listen to all the ""good"" stories, you have to work out YOUR consumption requirements, yours will be different to every one else. first step is forget the $$$ value of your power bill and start thinking of it in real terms which is kW/hrs. read your power meter morning and night set up a spread sheet or a diary and work out what your day time consumption really is. if it is low ie your not using power between 8-5 because no one is home then the payback will be much longer. look to what things you can move onto day time consumption and spread out over the day - dishwasher, washing machine etc because that will be free. if your close to retirement age then probably bigger would be better to factor in more time at home during the day when retired. if not close to retirement then I'd suggest dont go any bigger than you really need or you may never break even on capital outlay",Cost,Australia,Solar Energy
1273,Very Positive,4.6148,Can anyone recommend a provider? I'm been interested for a while but every solar provider I speak to sounds like a used car salesman and then hound me for weeks to sign up while I'm trying to decide so I just don't want to use them on principle,Jobs,Australia,Solar Energy
1274,Neutral,3.256,Very much worth going to https://www.solarquotes.com.au/. They've done the hard yards in weeding out the shitty installers.,Cost,Australia,Solar Energy
1275,Neutral,3.8402,Solar Wholesalers based in Mount Barker. Had a large system installed late 2022. Zero issues throughout process. Highly recommended.,Infrastructure,Australia,Solar Energy
1276,Neutral,3.9534,Its worth it if someone is at home during the day while solar is being generated. The feed in tariff is a joke,Cost,Australia,Solar Energy
1277,Very Positive,4.5812,Yes it's worth it. You can run your AC for free during the day essentially if it's sunny.,Technology,Australia,Solar Energy
1278,Negative,2.8968,If you use electricity during the day then yes absolutely worth it. Feed in is dead. We also have a battery and if we are careful it gets us through the night and into the morning when the sun comes up.,Technology,Australia,Solar Energy
1279,Positive,4.2248,"It looks like you're not calculating correctly. I've had PV for over 20 years, recently moved and did a new install of a 6.6Kw system and in month 2, the FIT dropped by 25%. Here's my figures so far: Month 1, my total bill was $3.21; month 2 - $8.40 which includes all the poles & wires as well as usage charges.",Tax,Australia,Solar Energy
1280,Neutral,3.0,Easily. I basically don't have a power bill.,Cost,Australia,Solar Energy
1281,Positive,4.4538,Why don't Australian homes use solar water heaters? I lived in Cyprus and almost every home had one in 1990's. We even had free hot water in winter if it was sunny.,Policy,Australia,Solar Energy
1282,Neutral,3.9878,It used to be very popular. I remember every second home seemed to have one of those 'solahart' systems on the roof. They've fallen out of favour because a complete solar system is more effective.,Cost,Australia,Solar Energy
1283,Very Positive,4.9286,Im in crdit every month but got the first lot installed 2012 then others later. Export 12 kw at peak in the middle of summer. It comes down to savings v cost. If you spend 10k and you have a home loan @ 7.95% you need to save about $800 to break even. If you dont have a home loan and have cash in the bank that 800 does not come into it. The only question then is which is going up quicker? Interest rates or power prices? The other thing is time if use. If you can use power during the day its a better saving but if you work all day and only home after hours you will not benefit much from exported electricity,Cost,Australia,Solar Energy
1284,Neutral,3.0,When we built our house 8 years ago the first thing we sorted out was solar panels and we havent had an electricity bill in all that time. 2 adults 3 teenagers.,Investment,Australia,Solar Energy
1285,Neutral,3.4526,"Yes its worth it, our power bill for the last 3 months is $57",Cost,Australia,Solar Energy
1286,Very Positive,4.7932,"6.6kw with 5kw inverter installed in March 2022, bills went from about $800 to either a small credit during summer or about $150-200 in winter. Im currently still paying off the panels on a 3 year plan that was designed to be about what I was spending on the bills minus what my system would be saving me but its worked out to be slightly better than what I was told which is great. I got my system with Sunenergy.",Technology,Australia,Solar Energy
1287,Very Positive,4.8834,"I installed panels in August, my last Bill was a credit, and it wasnt a complete quarter on solar. I had to rework some of the timings that I used to do things a little, to make use of the best times for power generation, but the installer estimated a 5th at time horizon to pay it back, on current figures I think it will be less. Caveats - I largely work from home so can maximise use during the day, but if you use smart appliances and smart adaptors on powerpoints, you can still get some benefit through timers and remote start features. Im also in a newer home where the insulation is very good, which helps with need to run heat/cool appliances",Cost,Australia,Solar Energy
1288,Neutral,3.0,I don't own the solar but the property I'm in has it. 15 dollar electricity bill living alone for a quarter. I think yes.,Technology,Australia,Solar Energy
1289,Neutral,3.2596,"it saves you money, but having to buy the power back off them at nearly 10 times the amount you sold it to them at is really annoying. Idk how that's legal.",Tax,Australia,Solar Energy
1290,Very Positive,4.8084,"We got solar panels on our first house when the feed in tariff was 48c from the Govt, and 10c from Retailer. We had 4.5kw of panels and 3 quarters out of 4 we'd have a credit at least large enough to cover the winter bill, and often made money. 3 major things have changed since. Solar panel cost and tech is bigger and better. More efficient panels, that cost less generate more and last longer. That's a good thing. However. No feed in tariff. Actual cost of power is close to 80% higher than what it was when we first got panels. We installed 11kws of panels and a Tesla Powerwall on the new home. We make $0 feed in but it has stopped power bills for 3 quarters of the year, and substantially offset the winter bill. For context, our summer quarter bill was $1900. 11kw system with powerwall was $0 up front, and $500 per month for 5 years. So we were actually paying about the same amount for power, except in year 6 we save about $5000 in power (more if the cost per kW increases. Is it worth it? Hell yes. Is it cheap and easy. F no.",Tax,Australia,Solar Energy
1291,Neutral,3.0,"Over average power bill is ~$230 a month. We're living in a house with solar at the moment, and while that amount doesn't really go down during winter for obvious reasons, from the months of Sept-April bills go down to around ~$70. Averaged over 12 months that's around about a 40% discount on our regular power bill. We get jack-shit in the way of feed-in",Infrastructure,Australia,Solar Energy
1292,Very Positive,4.6148,"SA here, short answer no, long answer hell no. have a 6.64kwh system, I feed into the system more than I use on a daily basis majority of the time. even using the bulk of the power during the day hours. average use is about 24kwh (30kwh including hot water but that will be solar soon too) i feed in about 30kwh a day (washing, drying(live in a town where we are not allowed dry clothes outside due to lead and the kids) dishwasher etc are all run during the daylight hours when generating excess power. still have high power use at night cause most of the family isn't home during work/school hours and can't learn to turn off a fkn light or shut the door so the cooling actually works. the ONLY way a high use/large family is going to benefit from solar is if they slap batteries on too. I actually did the math and for $20K I can get a 26kw battery system installed that will pay for itself after 4-5 years and then I will save money.",Cost,Australia,Solar Energy
1293,Positive,4.4006,"Yes. If you have north facing panels theyre great for day time power consumption (11am-4pm on average. If you can have them west facing theyre great for the 1-5pm (still some power earlier than this) time all year, and all the way up to 8pm during summer. A combo of both is perfection. They do fuck all on cloudy days- especially in winter, but for 9 months of the year, they are an excellent investment. In both my examples, learn to program your aircon and washing machines to make use of the sun.",Technology,Australia,Solar Energy
1294,Very Positive,4.5434,"Yes, reduces the bill by approx $100-200 a month if it's generating. I have a very shady area with huge trees everywhere. Winter it's basically useless though. But if the sun is out at all, it performs pretty well. Even partly cloudy, it's fairly good.",Cost,Australia,Solar Energy
1295,Positive,4.2972,No doubt. We've got 3-phase and 13kw of solar and we get a hefty credit every quarter. Best decision we made.,Investment,Australia,Solar Energy
1296,Very Positive,4.7378,If someone tells you it is not worth it must have done something wrong. Do your research and contact people to learn more. We have 9kwh of panels 9kw battery. We just got EV which we charge from solar. Watercooler on roof uses basically no power today. Battery recharged by 10am most the year. Most months we use 2-6kW of power. This is something we cant control. They say it runs the meter and inverter. Next project is new oven and induction cooktop or heat pump hot water. We have solar gas boosted and it seems it just uses gas during summer and never gets hot enough on cold days. Im looking for a company that will do a wet radiator system to heat the house using heat pumps. Its good having no bills and the tech is fun.,Infrastructure,Australia,Solar Energy
1297,Neutral,3.0,When have energy costs ever dropped?,Economy,Australia,Solar Energy
1298,Very Positive,4.5158,"Massively. Paid for itself in under 3 years. Now Im saving thousands every year. With a little scheduling, I run my clothes washer/dishwasher/pool pump completely free.",Cost,Australia,Solar Energy
1299,Positive,4.0534,For me at home yes. For me at work no. When I changed may business plan the put up the supply rate from $1 per day to $3 which off set all the gains I was going to get.,Cost,Australia,Solar Energy
1300,Neutral,3.0,Last monthly bill was 7 bucks so I guess,Cost,Australia,Solar Energy
1301,Neutral,3.0,"Depends, If you export most of the electricity to the grid then the answer is no.",Cost,Australia,Solar Energy
1302,Positive,4.1718,"If you are buying now, you need to get one with a battery & big enough to cover your entire usage.feed in tariffs are much lower now but the battery allows you to use your own power at night. Feed in tariff would only apply to excess power generated when you battery is full. You can still reduce your electricity bill but it will take longer to recoup your initial outlay. I would still recommend Solar. (With a battery you can also have blackout protection if its installed with the right configuration)",Cost,Australia,Solar Energy
1303,Neutral,3.8808,If you're a solar panel cleaner in the US join my group - https://www.facebook.com/groups/1085283579150450/,Jobs,Australia,Solar Energy
1304,Very Positive,4.5866,"Ausgrid, which has about 280,000 customers in New South Wales with rooftop solar panels, has introduced a two-way tariff system to incentivise solar panel owners to export their power into the grid in the evening, when it is most needed. That 'evening peak' is between 1600 and 2100. What the fuck are solar systems exporting during that period? You'd need a battery system in order to do that, and if you're doing that, the proposed export rates are so low that there's almost no incentive to do so. You'd be better off exporting nothing and keeping it all for yourself. That's ignoring the cost of the battery which are still expensive. I agree that the overinflated export prices that some people enjoyed were a joke, but there shouldn't be anything charged to people exporting to the grid when a lot of those plans have higher base supply charges anyway. I've had home solar to offset my energy usage (mostly air conditioning, night shift worker), with exporting being a nice little bonus but not the primary reason. If it's that much of a burden, don't offer an export payment.",Infrastructure,Australia,Solar Energy
1305,Positive,4.1988,"I am part of the trial, which ends on the 1st of July. The trial boosted FiT times are 2pm to 8pm, and it gives a bonus 25c per kWh on top of existing FiT. I have a battery and pay wholesale prices, so am often getting around 80c per kWh (ignoring spikes, where I get $3 per kWh and over) from dumping my battery into the grid in the evening. The new version is heavily nerfed and overall not worth opting into.",Cost,Australia,Solar Energy
1306,Neutral,3.0,It's more expensive to install a system with a power meter so it can limit exports - my dodgy installer didn't put one in 3 years ago because I didn't realise it wasn't included.,Infrastructure,Australia,Solar Energy
1307,Neutral,3.592,The problem is supply exceeding demand. So companies encourage you to reduce supply. The best solution is for households to combine battery storage with solar panels. Every change re solar panels seems to be pushing adoption of batteries,Technology,Australia,Solar Energy
1308,Neutral,3.6364,"The best solution is for households to combine battery storage with solar panels. If only that solution was even remotely financially viable. The batteries don't save you enough money in their warranty period to pay for themselves, let alone any profit.",Cost,Australia,Solar Energy
1309,Positive,4.1718,"exactly, supply and demand 101. the fact that solar is cheap and plentiful should be hailed as a good thing. but when the layman sees that it being cheap and plentyful means the value of electricity they are trying to sell during the day is 0 or negative then all of a sudden its a bad thing. batteries arent yet financially viable, but having appliances that can turn on during the day is an easy way the layman can save with solar",Cost,Australia,Solar Energy
1310,Neutral,3.0,Let them get away with it and the price they charge will go up and up. The 1.2c charge per kWH is just to normalise charging you.,Cost,Australia,Solar Energy
1311,Positive,4.3194,"I mean, if you told me 5 years ago that my solar investment would be generating 0 dollars or in fact costing me money to feed it back into the grid. I probably wouldnt have bothered to get the system installed. Most roi calculators are based on the information people currently have on hand. So its a bit rich to do a full 180 on it. Completely understand why network operators are doing it, but a long notice period for people to adjust their systems or usage would be a bare minimum that they could do.",Technology,Australia,Solar Energy
1312,Positive,4.1718,People did tell you 5 years ago that FIT would trend towards zero as solar expanded. There were already days of negative prices for commercial solar farms years before that.,Technology,Australia,Solar Energy
1313,Positive,4.2394,"Our electricity prices have doubled from the same time last year, This is nothing more than more cooperate greed and price gouging. Like it says in the article ""Im not going to be generating much power after 6 or 7pm in summer, and not much after 5pm in winter"" This is all about making more money for the energy company. This is something the government need to step in and stop. Prices cant just keep going up indefinitely people cant afford to live, and now there finding away to charge customers more who have solar. They not trying to do anything but line there pockets. This is what happens when you privities its all about profit and nothing else.",Cost,Australia,Solar Energy
1314,Neutral,3.0516,"Unpopular opinion, but you absolutely should be charged for exporting at peak ""solar generation"" times. Home solar systems need to have the correct metering so exports can be restricted. During summer days in Australia the wholesale energy price can reach -$0.20 per kWh. Not a typo - NEGATIVE twenty cents. As in, wholesale providers will be paid to consume energy, and charged for exporting it. Too much energy being pumped into the grid causes problems with electrical infrastructure. ",Cost,Australia,Solar Energy
1315,Positive,4.3194,Sounds like the providers would profit from building some batteries huh?,Technology,Australia,Solar Energy
1316,Neutral,3.0,"That is their problem. If they no longer wish to do it, they can sell their investment back to the people.",Tax,Australia,Solar Energy
1317,Negative,2.744,"Exactly - the energy market isn't a profit measure, it's an engineering measure to make sure supply and demand are matched and shit doesn't explode. Excess power is toxic and so damn straight you should be charged to have the grid take it away. Or you can do the thing they want you to do and stop exporting!",Infrastructure,Australia,Solar Energy
1318,Neutral,3.9176,I don't know the exact numbers but if they're paying you like 2c for your power and selling it to other people at 20 or 30c how the F do they have the gall to charge you for doing that? Like they're not making enough already? And don't forget elec prices jumped up around 40% the start of last financial year.,Cost,Australia,Solar Energy
1319,Neutral,3.7224,There's a lot of extra work the resellers factor in when exporting solar. Things like being slimy cunts and carrying the 1. Sometimes they have to update their webpage so that it shows the most recent news from 2003. It all adds up.,Technology,Australia,Solar Energy
1320,Negative,2.2776,"The distributors role is running the poles and wires, they arent the ones charging you money for your usage, you fundamentally misunderstand the situation",Policy,Australia,Solar Energy
