,Sentiment,Sent_Scale,Text,Topic Key,Country,Type of Resources
3,Negative,2.0,eu focus world developed country responsible picking burden taking step response climate changehowever international community see united state europe promise turn cake step backthe development chinese clean energy technology industry provided great possibility global green transformation west happy breakthrough,Technology,China,Other
4,Negative,2.0,china far ahead green energy industry policy new york time united state europe trying catch competitor good using mean government bank dominate global manufacturing industry half century concern shortage oil damage climate prompted government invest energy th century,Policy,China,Other
5,Neutral,3.0,according data bloomberg new energy finance two major climatic policy china carbon dioxide emission begin decrease year year indicating china greenhouse gas emission may reached peakthe increase renewable energy output use electric vehicle increased significantly second quarter year source bloomberg,Investment,China,Other
6,Neutral,3.0,according data bloomberg new energy finance two major climatic policy china carbon dioxide emission begin decrease year year indicating china greenhouse gas emission may reached peakthe increase renewable energy output electric vehicle adoption rate greatly reduced coal power oil consumption second quarter year source bloomberg,Investment,China,Other
7,Very Negative,1.0,chinese president xi jinping said china provide policy support chinese funded enterprise investing malaysia malaysia including investment new area renewable energy semiconductor digital economyhttpsorientaldailycommynewsnation,Policy,China,Other
8,Neutral,3.0,stock morgan datong asset management looking investment opportunity background china economic growth expected china proactive policy responding economic slowdown continue increase holding structural growth potential including sector related green energy consumption increasing holding technology hardware meet need new artificial intelligence creation cyclical recovery consumer electronics product,Policy,China,Other
9,Negative,2.0,one third global greenhouse gas come china emissionsthe goal within degree celsius industrialization global temperature rising level largely depends china climate policy large extent china pioneer field renewable energy electricity come wind power hydropower solar power generation thing often another side china depends coal power generation last year china electric power came firepower power generation dw,Policy,China,Other
10,Negative,2.0,popular market view china concerned economic downturn mainly new productive force advanced manufacturing high tech product green energy transportation key china fiscal policy relaxed mainly trump onto loose tool important thing real real estate save real estate dont want become foundation future economy,Policy,China,Other
11,Negative,2.0,china rare earth policy adjustment aroused attention western medium day ago state council announced rare earth management regulation clearly clarified rare earth resource belonged state china implemented protective mining rare earth resourcesafter announcement announced immediately received great attention western mediathis rare earth resource play important role high tech manufacturing green energy transformation also lot western medias view china,Policy,China,Other
12,Negative,2.0,kerry said plan meet chinese climate special envoy highest level official july china united state also two largest investor clean energythe policy two country huge impact whether world avoid serious consequence global warming however profound difference two side fossil fuel emission two country stop earth severe heating httpsbufflydaisdm,Policy,China,Other
13,Negative,2.0,according international energy agency last year united state european union achieved major progress field clean energy technology biden government billion dollar one widely used industrial policy united state bidens increase tariff upgrade united state targeted trade offensive china approach levy tariff began former president trump,Policy,China,Other
14,Very Negative,1.0,white house considering whether reduce tariff affect american consumer time impose new tariff china green energy technology export biden government announced suspension tariff solar industry two year period suspension order united state may restart solar tariff summer china dissatisfaction u trade policy httpsbufflyarztfj,Policy,China,Other
15,Neutral,3.0,expected european official soon improve tariff china although economist environmentalist warn measure slow process cleaning energy targetsbecause china inclined russia iran europe become concerned security issue practice western acceptance industrial policy come counter open market united state ally previously advocated minimal government intervention,Policy,China,Other
16,Very Negative,1.0,guoxuan hi tech obtained million state subsidy michigan strategic fund including gift tax freethe company also eligible obtain tax credit inflation act chinese company may get tax credit related green energy manufacturing investment related billionrepublicans congress proposed legislation prevent chinese company obtaining tax claim,Policy,China,Other
17,Negative,2.0,english translation word central committee communist party china emphasized industrial policiesthe party promise improve promotion strategic industry involving eight area renewable energy aerospacethese industry basically industry made china plan year,Other,China,Other
18,Very Negative,1.0,china become world factory foundation heavy industry provide cheap raw material cheap raw material come cheap energyonce current coal power energy replaced clean energy cost china manufacturing industry rise sharply many chinese company difficult survivetherefore policy kill chinese economy destroy existing economic foundation economic structure china economic structure collapse,Policy,China,Other
19,Very Negative,1.0,germany accelerating sinicizationcheck social environment id vaccine certificate everywhere compare price level california housing price quickly move closer first tier city chinano green energy policy finally european central bank monetary policy,Policy,China,Other
20,Positive,4.0,china financial medium report summary national frequency deploy accelerate stability economy take effect implementation stability economy fourteen five year plan renewable energy planning china banking regulatory commission strong party strong rectification insurance institution collect insurance fund affiliated transactionsshanghai economic information commission three operator opened set digital sentry detail httpororvipebadebbdebebbbfeaaapeaaeebebbbcaebdebbbcaeeeaebdbeaabfababbbbeeeeb,Economy,China,Other
21,Positive,4.0,vietnam renewable energy development strategy opportunity china enterprise yang chao vietnam encourages development use renewable energy implementing flexible internet electricity price investment protection policieschinese company actively participate construction vietnam renewable energy projectsmore detail httpororvipebaedefefebdbdebaefebeeaeebadebceaecbaebca,Policy,China,Other
22,Very Positive,5.0,frequent policy technological breakthrough development clean energy foundation china economy,Economy,China,Other
23,Very Negative,1.0,renewable energy electrification policy biden harris rely united state rely china thereby restraining united state restraint communist party china reason claimed dangerous policy fossil fuel leading climate change must forced stop consumption policy weakened united state causing incomparable harm poor people farmer small enterprise primary task next government abolition,Policy,China,Other
24,Very Negative,1.0,rescue united state ccps biden government renewable energy electrification policy encouraged purchase china renewable energy electric vehicle battery key mineral time prevented development use domestic oil natural gas supply destroying u energy security independence caused united state rely china rely chinathe next government abolish policy,Policy,China,Other
25,Very Negative,1.0,rescue united state ccps biden government renewable energy electrification policy encouraged purchase china renewable energy electric vehicle battery key mineral time prevented development use domestic oil natural gas supply destroying u energy security independence caused united state rely china rely chinathe next government abolish policy,Policy,China,Other
26,Positive,4.0,according international energy agency china lived leader renewable energy application international energy agency said report nearly global renewable energy power generation china future although chinese government suspended series subsidy new energy field construction wind power plant solar power plantsthe momentum still strong,Policy,China,Other
27,Very Negative,1.0,year old president trump spoke emotional speech campaign rally pain united state due corruption biden internal economy collapsed bank closed interest rate soaredbecause implementation new left wing green policy loss energy independence prohibited energy independence begged countriesknowing electric vehicle cant go far cost high rely chinese production still necessary promote comprehensive electrification even including military tank,Policy,China,Other
28,Neutral,3.0,hydrogen energy regarded pure green energy people sustainable energy source used various industry however higher cost cannot completely replace current fossil fuel clean energy potential futuredeloitte world largest accounting company provided hydrogen energy prospect chinese government september year list detail potential assessment hydrogen energy various industriesfor car bus prospect good household car low,Policy,China,Other
29,Very Negative,1.0,year old president trump spoke emotional speech campaign rally pain united state due corruption biden internal economy collapsed bank closed interest rate soaredbecause implementation new left wing green policy loss energy independence prohibited energy independence begged countriesknowing electric vehicle cant go far cost high rely chinese production still necessary promote comprehensive electrification even including military tank,Policy,China,Other
30,Very Negative,1.0,read article day saying europe hot recently hot europe nt believe reading air conditioner germany later askedin germany installation fee actually cost china free install counted electricity fee actually five time china consequence green energy,Other,China,Other
31,Negative,2.0,eu focus world developed country responsible picking burden taking step response climate changehowever international community see united state europe promise turn cake step backthe development chinese clean energy technology industry provided great possibility global green transformation west happy breakthrough,Technology,China,Other
32,Very Positive,5.0,green transformation new engine sustainable economy china facing challenge global climate change china actively promoting economic green transformationthrough development renewable energy promote green low carbon technology,Economy,China,Other
33,Very Positive,5.0,zhang xingying member national committee chinese people political consultative conference deputy director department science technology climate change china meteorological administration said capacity country renewable energy installed capacity rank first world world new greening area come china country becomes time operate time dawn morning afternoon leaning rail orbital meteorological satellite providing earth observation data real time country,Technology,China,Other
34,Positive,4.0,un general assembly trump criticized china carbon emission almost twice much united state biden vowed elected would take stronger position issue climate changexi promised china would achieve carbon neutrality bold commitment issue climate change farthis political basis expected greatly increased th five year plan,Environment,China,Other
35,Positive,4.0,un general assembly trump criticized china carbon emission almost twice much united state biden vowed elected would take stronger position issue climate changexi promised china would achieve carbon neutrality bold commitment issue climate change farthis political basis expected greatly increased th five year plan,Environment,China,Other
36,Neutral,3.0,biden policy new coronary virus epidemicnational test tracking employment financeimprove minimum wage green energy race issuescriminal judicial reform ensure minority community climate changereturn climate agreement foreign policythe united state challenge china medical healthexpand obama medical insurance immigration policyrevisit trump immigration policy educationfree college police class national school,Policy,China,Other
37,Negative,2.0,president bidens climatic problem john pudsta went beijing tuesday plan talk official chinese climate special envoy liu zhenmin official responsible coal development renewable energy productionit expected urge chinese leader formulate ambitious plan reduce greenhouse gas emission lead climate change,Technology,China,Other
38,Positive,4.0,first canadian minister visit china past four year canada environment climate change minister gilbut set beijing th participate talk climate change protect biodiversityboth canada china large emission power two important issue gilbut want ask time methane emission reduction global renewable energy goal hope make sincere dialogue climate related issue,Environment,China,Other
39,Very Negative,1.0,china renewable energy installed scale reached billion kilowatt end last year total amount renewable energy many developed country reached china level deal climate change china never spoken contrast billion yuan developed country fulfilledblack first place,Environment,China,Other
40,Positive,4.0,twenty eighth conference convention framework united nation climate change held dubai uaeat un climate change conference issue formulating emission reduction plan reducing fossil fuel production oil coal increasing use renewable energy use become focus discussion camera director international renewable energy agency said china achievement field renewable energy remarkable,Environment,China,Other
41,Very Positive,5.0,zhang xingying member national committee chinese people political consultative conference deputy director department science technology climate change china meteorological administration said capacity country renewable energy installed capacity rank first world world new greening area come china country becomes time operate time dawn morning afternoon leaning rail orbital meteorological satellite providing earth observation data real time country,Technology,China,Other
42,Very Negative,1.0,g new china federation news interview environmental protection global warming become cultus congress launched natural gas potential bill trying break restriction self sufficiency energy talk main point u house representative launched natural gas potential plan talk current u energy policy suppress traditional energy reason behind global warming pseudo proposition environmental protection excuse interest,Policy,China,Other
43,Negative,2.0,order check balance china g country learn chinese experience biden held hope united state competition advanced energy technology help cope climate change past month series law signed vigorously enhance industrial capacity united state export technology chinaimplement new restriction imitate china industrial policy adopted become leader world manufacturing industry httpscnnytimescomworldbidendustricy,Policy,China,Other
44,Positive,4.0,qin gang modernization person harmony nature definitely provide feasible solution construction clean beautiful worldpresident xi jinping pointed green mountain green mountain jinshan yinshansolar installation capacity occupies,Other,China,Other
45,Very Positive,5.0,belt road initiative china may share experience development renewable energy technology green economic development great value responding climate change promoting sustainable development,Economy,China,Other
46,Very Positive,5.0,china renewable energy developed year scratch small large installed capacity production capacity forefront worldit contributed greatly country clean low carbon transformation global climate change,Environment,China,Other
47,Neutral,3.0,tractor niu course metaphor said high production efficiency accompanied high energy application high carbon volumeits amount carbon discharge agricultural account mainhowever expert studying climate change found china build large number coal mine obviously driving reversing climate policy,Policy,China,Other
48,Positive,4.0,executive director un environmental planning agency ing ying anderson praised china contribution global response climate change interview china daily pay special attention field renewable energy,Environment,China,Other
49,Very Positive,5.0,moment climate problem severe china one world largest carbon emission country vigorously promoted development renewable energy showed world new direction actively cope climate change,Technology,China,Other
50,Very Negative,1.0,renewable energy electrification policy biden harris rely united state rely china thereby restraining united state restraint communist party china reason claimed dangerous policy fossil fuel leading climate change must forced stop consumption policy weakened united state causing incomparable harm poor people farmer small enterprise primary task next government abolition,Policy,China,Other
51,Positive,4.0,symposium china pakistan climate change renewable energy seminar httpchinanewscomgnshtml,Environment,China,Other
52,Positive,4.0,everything china going essential global effort slow catastrophic climate change updated ndc promise four main content proposed chinese leader xi jinping china carbon dioxide emission reach peak intensity carbon dioxide emission decrease compared ensure renewable energy occupies energy sourcesa quarter consumption proportion,Environment,China,Other
53,Positive,4.0,mining policy still determine australian election current conservative government insists making smallest effort climate change issue make china symbolic cultural economic impact imported coal transformation imposed u said richmian director climate energy project independent think tank australia research instituteits hard see thing really improve,Policy,China,Other
54,Positive,4.0,biden hug hope united state competition advanced energy technology help cope climate change signed series law previous month effort mimic china industrial policy adopted becoming leader world manufacturing industryduring meeting bali xi jinping urged latter give practice,Policy,China,Other
55,Very Positive,5.0,china united state agreed jointly respond global warming problem gradually replace fossil fuel use renewable energyclimate cooperation regarded one highlight worship meetingchina promised gradually reduce coal use stop approval build new coal fired power plant agrees set emission reduction target greenhouse gas emission including methane,Environment,China,Other
56,Negative,2.0,number global coal fired power plant increased mainly caused slowdown slowdown china new power plant western countriesscientists call giving coal soon possible avoid global warming industrialized country china india set longer energy transition periodin rich country loan develop country help turn renewable energy use fund limited,Other,China,Other
57,Very Positive,5.0,mobilia technology unique technology developed grass generation wood far technology extended country around worldfor year fujian established friendly relation many pacific island nation fungus technology originated fujian introduced benefit local peoplethe belt road country region generally welcomed,Technology,China,Other
58,Negative,2.0,china sustainable development obvious december last year th conference convention framework united nation climate change set goal increasing renewable energy installation capacity time china world largest renewable energy market equipment manufacturer past year growth global non chemical energy consumption contributed global renewable energy supply million kilowatt china contributed half,Economy,China,Other
59,Negative,2.0,th united nation climate change conference cop china india populated country failed support increase renewable energy source original three fold commitment country generally satisfied non statethe promise fossil energy transformation became unsatisfactory,Environment,China,Other
60,Negative,2.0,website royal elkano institute spain published entitled china ready joint leadersthe article stated december whether th un climate change conference successful madrid successful climate change whether paris agreement implemented china attitude one decisive factorchina actively participating international sustainable project financing beijing leading position renewable energy investment,Investment,China,Other
61,Very Positive,5.0,zhang xingying member national committee chinese people political consultative conference deputy director department science technology climate change china meteorological administration said capacity country renewable energy installed capacity rank first world world new greening area come china country becomes time operate time dawn morning afternoon leaning rail orbital meteorological satellite providing earth observation data real time country,Technology,China,Other
62,Negative,2.0,effect daniel john talk opposition china united state decarburization energy issue expert daniel jean said u authority intend cooperate china issue climate changechina deeply embedded global economyit difficult introduce policy isolation chinachinas emission reduction simply worrying air pollution global environment httpscnnikkeicomcolumnviewpointviewpointhtml,Policy,China,Other
63,Very Negative,1.0,indeed impossible double economic scale solve problem global warming china want fulfill zero carbon commitment china must eliminate nine tenth factory think must consider another reality trajectory even without considering global warming current trend end fossil fuel terminated longer industry renewable energy cannot change,Economy,China,Other
64,Negative,2.0,china care climate change former white house press secretary sean steres criticized united state try negotiate china think china care qiao biden xi jinping met asia pacific economic organization summit discus manage strategic competition two global super power improve communication channel united state china agree restart negotiation energy policy establish working group strengthen climatehttpstcohcmtuvbhs,Policy,China,Other
65,Very Positive,5.0,ifchongqing become center global crisis point extreme weather threatens grain supply brought drought heat wave climate change debate renewable energy andcoronary virus zero method ofchina ongoingessence,Environment,China,Other
66,Very Positive,5.0,actually infrastructure fiscal based infrastructure finance china transformation opportunity develop manufacturing industry necessary larger added valueall people th industry arranged second session nd plenary session grasp primary major event future,Investment,China,Other
67,Very Positive,5.0,actually infrastructure fiscal based infrastructure finance china transformation opportunity develop manufacturing industry necessary larger added valueall people th industry arranged second session nd plenary session grasp primary major event future,Investment,China,Other
68,Negative,2.0,climate change left open mouth use climate change transfer attention domestic policy issue way increase advancement new energy know country largest beneficiary country new energy china us price war suppress global lithium battery market early day lithium battery mine region income delisted acquired global acquisition even tesla lowered head eat chinese battery,Policy,China,Other
69,Neutral,3.0,basically investor grasp china carbon neutralization policy stop energy structural change around background considered long term considerationat time necessary consider effort human warming climate must fail consider investment opportunity grain industryconsidering impact disaster climate energy food,Policy,China,Other
70,Very Positive,5.0,high quality co construction belt road green always bright backgroundfrom proportion renewable energy investment belt road project increased significantly nearly exceeding fossil energy investment actively responding international call actively fulfilling environmental protection responsibility carrying ecological environment governance focusing focusing onbiological diversity protection actively participate global climate change treatmentshare belt road initiative,Investment,China,Other
71,Very Positive,5.0,agreement strengthen political dialogue global concern provide space mutually beneficial cooperation wide policy field including environmental energy climate change transportation trade employment social affair human right agriculture preventionprowing anti terrorism crackdown organizational crime immigrant httpschinapresscommyp experience first subscribe immediately step easy httpschinapresscommysubscribe,Policy,China,Other
72,Very Positive,5.0,rt mofazhuzhu china promoted grass technology one hundred country around world helping developing country eliminate poverty promote employment renewable resource respond climate change technology maintains sustainable developmentit happy grass benefit people developing country,Jobs,China,Other
73,Positive,4.0,new policy requires belt road project consistent paris agreement belt road initiative must consistent paris agreement china promote convention framework united nation climate change paris agreement especially supporting energy transformation green transportation httpsarchivephwiplmkv,Policy,China,Other
